Id,highlighted,text,ru_trans,tags,prefix,suffix,position_start,position_end,start_container,end_container,chapter,ch
Bzb2ukNSEe2yQsdzdHat8w,притча,"A fable. Also, colloquial: an unexpected event/circumstance.",,['register/style'], недвижимое не навестил. Что за ,", зачем я туда не направлюсь уже",9406,9412,/div[1]/main[1]/article[1]/p[1]/hypothesis-highlight[173],/div[1]/main[1]/article[1]/p[1]/hypothesis-highlight[173],08. Заитильщина,08_ru
GeubikNSEe2sIddA6zBDxA,челне,A light wooden boat. Pictured here: ![](https://upload.wikimedia.org/wikipedia/commons/c/c1/Monoxylon._Karelia.jpg) Boat motif.,,['motif'],не направлюсь уже на артельском ,"? А затем, что пропили 
мы артел",9459,9464,/div[1]/main[1]/article[1]/p[1],/div[1]/main[1]/article[1]/p[1],08. Заитильщина,08_ru
inLu7kNSEe25NXPtuNHWyg,"Пареной 
репе","Set expression: проще пареной репы (easy as pie, like rolling off a barrel, easy as can be). Speaks to how easily turnips could be found.",,['phraseologism'], же способом раз двадцать пять. ," подобен, но всякую снасть или ж",9543,9556,/div[1]/main[1]/article[1]/p[1],/div[1]/main[1]/article[1]/p[1],08. Заитильщина,08_ru
OZEC-ENTEe2m4JsgRMC0oQ,живность,"Colloquial: small fry, small game, living things.",,['register/style'],"е подобен, но всякую снасть или "," дозволяет пустить 
в оборот не ",9587,9595,/div[1]/main[1]/article[1]/p[1],/div[1]/main[1]/article[1]/p[1],08. Заитильщина,08_ru
Ynu2XkNTEe2QoyNkGyRjgQ,"пустить 
в оборот","Set expression: to put into circulation, put in requisition, give the works.",,['phraseologism'],ю снасть или живность дозволяет , не единожды. Нету денег порой; ,9606,9623,/div[1]/main[1]/article[1]/p[1],/div[1]/main[1]/article[1]/p[1],08. Заитильщина,08_ru
FkGwwkNTEe2YPLd3OF6kWA,единожды,Dated: once.,,['register/style']," дозволяет пустить 
в оборот не ",". Нету денег порой; ничего, дело",9627,9635,/div[1]/main[1]/article[1]/p[1],/div[1]/main[1]/article[1]/p[1],08. Заитильщина,08_ru
bxuaDIejEe2b8IdKG-VtYA,ихнее,low,,"['language', 'style/register']"," Нету денег порой; ничего, дело ",", зато 
есть кот. Не у нас, поня",9668,9673,/div[1]/main[1]/article[1]/p[1],/div[1]/main[1]/article[1]/p[1],08. Заитильщина,08_ru
jj5kdkNTEe2kmxvrIo_8ag,мельника,"Miller, related to the term мельница (mill, melnitsa), playing on the connection between ""milling"" and ""pastries."" Sokolov will use the connection between torment (мука)/flour (мука) several times throughout the novel as well.",,"['metaphor', 'character', 'intratextuality']",", мышь железа пока не кушает, у ",", видите ли, имеется кот. И прик",9768,9776,/div[1]/main[1]/article[1]/p[1],/div[1]/main[1]/article[1]/p[1],08. Заитильщина,08_ru
qMOoYENTEe2j8W_cD9GF1Q,прикидывается,"Colloquial: to pretend, sham, simulate.",,['register/style'],"ника, видите ли, имеется кот. И ", один из шатии перехожим каликою,9804,9817,/div[1]/main[1]/article[1]/p[1],/div[1]/main[1]/article[1]/p[1],08. Заитильщина,08_ru
v9n__kNTEe23KceosxpDnQ,шатии,"Colloquial: gang, tribe, crowd.",,['register/style'],ся кот. И прикидывается один из , перехожим каликою и переходит к,9826,9831,/div[1]/main[1]/article[1]/p[1],/div[1]/main[1]/article[1]/p[1],08. Заитильщина,08_ru
Cw9_ikNUEe2XIFMQ6H64kg,перехожим каликою,"A name given to blind wanderers who sing spiritual poems. Originally, the word did not refer to disabled or crippled beggars, as it does now, but rather to wanderers who visited holy places and sang songs. The term is derived from the Latin *caligae*, pictured here: ![](https://upload.wikimedia.org/wikipedia/commons/c/cf/Caliga_Qasr_Ibrim.jpg) Since these wanderers often lived off of alms in the towns they visited (and occasionally settled in), the term took on the meaning of a disabled person who does the same in its modern usage. Depicted here: ![](https://upload.wikimedia.org/wikipedia/commons/6/6e/%D0%9F%D1%80%D1%8F%D0%BD%D0%B8%D1%88%D0%BD%D0%B8%D0%BA%D0%BE%D0%B2_%D0%9A%D0%B0%D0%BB%D0%B8%D0%BA%D0%B8-%D0%BF%D0%B5%D1%80%D0%B5%D1%85%D0%BE%D0%B6%D0%B8%D0%B5_1870.jpg) ([Miller 27–28](https://ru.wikisource.org/wiki/%D0%AD%D0%A1%D0%91%D0%95/%D0%9A%D0%B0%D0%BB%D0%B8%D0%BA%D0%B8_%D0%B8%D0%BB%D0%B8_%D0%BA%D0%B0%D0%BB%D0%B5%D0%BA%D0%B8_%D0%BF%D0%B5%D1%80%D0%B5%D1%85%D0%BE%D0%B6%D0%B8%D0%B5)) Also mentioned in Note XVIII (R204/E96), chapter 9 (R214/E112), chapter 10 (R223/E129), and chapter 11 (R230/E141). Shoe motif.",,"['foreign', 'Russia', 'intratextuality', 'motif']",. И прикидывается один из шатии , и переходит к мельнику на бугор,9832,9849,/div[1]/main[1]/article[1]/p[1],/div[1]/main[1]/article[1]/p[1],08. Заитильщина,08_ru
h2FfBENUEe2Ry8PhxzA2gw,мельнику,"Miller, related to the term мельница (mill, melnitsa), playing on the connection between ""milling"" and ""pastries."" Sokolov will use the connection between torment (мука)/flour (мука) several times throughout the novel as well.",,"['metaphor', 'intratextuality', 'character']",перехожим каликою и переходит к , на бугор: какое это село тут бу,9864,9872,/div[1]/main[1]/article[1]/p[1],/div[1]/main[1]/article[1]/p[1],08. Заитильщина,08_ru
hx4MokQKEe2rTJvc47dB-w,Не обессудь,"Dated/colloquial: to judge too severely, take too harshly.",,['register/style'],какое это село тут будет у вас? ,", Малокулебяково, мол. А я думал",9915,9926,/div[1]/main[1]/article[1]/p[1],/div[1]/main[1]/article[1]/p[1],08. Заитильщина,08_ru
oIJxQkQKEe2Yq4_CdiGuEQ,Малокулебяково,A town on the banks of the river.,,['location'],"о тут будет у вас? Не обессудь, ",", мол. А я думал — Мыломукомолов",9928,9942,/div[1]/main[1]/article[1]/p[1],/div[1]/main[1]/article[1]/p[1],08. Заитильщина,08_ru
uPNwjEQKEe2y0O-mRKG6Cg,кулебяко,"Сoulibiac (кулебяка, *kulebiaka*): a Russian pie pastry (pirog) typically filled with salmon or sturgeon, rice or buckwheat, hard-boiled eggs, mushrooms, onions, and dill. Pictured here: ![](https://upload.wikimedia.org/wikipedia/commons/3/38/Koulibiak_au_saumon.jpg?uselang=ru)",,"['Russia', 'explanatory']","т будет у вас? Не обессудь, Мало","во, мол. А я думал — Мыломукомол",9932,9940,/div[1]/main[1]/article[1]/p[1]/hypothesis-highlight[185],/div[1]/main[1]/article[1]/p[1]/hypothesis-highlight[185],08. Заитильщина,08_ru
2KKe7kQKEe2Iuyv-FaAd9w,мол,Colloquial: he says.,,['register/style'],"с? Не обессудь, Малокулебяково, ",. А я думал — Мыломукомолово тут,9944,9947,/div[1]/main[1]/article[1]/p[1],/div[1]/main[1]/article[1]/p[1],08. Заитильщина,08_ru
_hcYlEQKEe2QBxvg7sySww,Мыломукомолово,"Much as the characters' names shift, so, too, do the names of the town.",,"['explanatory', 'location']","алокулебяково, мол. А я думал — "," тут будет у вас. 
Нет, Мыкомуло",9961,9975,/div[1]/main[1]/article[1]/p[1],/div[1]/main[1]/article[1]/p[1],08. Заитильщина,08_ru
AEMGlkQLEe2_ZCepd1HEbA,Мыкомулоломово,"Much as the characters' names shift, so, too, do the names of the town.",,"['location', 'explanatory']","комолово тут будет у вас. 
Нет, "," — песня давняя, Мыкомулоломовым",9999,10013,/div[1]/main[1]/article[1]/p[1],/div[1]/main[1]/article[1]/p[1],08. Заитильщина,08_ru
AvUBCkQLEe22E5eppI94cQ,Мыкомулоломовым,"Much as the characters' names shift, so, too, do the names of the town.",,"['location', 'explanatory']"," Мыкомулоломово — песня давняя, "," мы 
прежде звались. Хм, а Милок",10030,10045,/div[1]/main[1]/article[1]/p[1],/div[1]/main[1]/article[1]/p[1],08. Заитильщина,08_ru
BXGNVEQLEe2YsoMVwRy3tw,Милокурелемово,"Much as the characters' names shift, so, too, do the names of the town.",,"['location', 'explanatory']","мовым мы 
прежде звались. Хм, а ", в таком варианте где? Малокулел,10072,10086,/div[1]/main[1]/article[1]/p[1],/div[1]/main[1]/article[1]/p[1],08. Заитильщина,08_ru
FX571EQlEe2RvofIpRZDkg,рече,"Archaism: from the Old Church Slavonic for ""to say.""",,"['archaism', 'register/style']","м варианте где? Малокулелёмово, ",", в другой стороне совсем, у нас",10125,10129,/div[1]/main[1]/article[1]/p[1],/div[1]/main[1]/article[1]/p[1],08. Заитильщина,08_ru
08-g4oejEe25i8dWvCOTvQ,в другой стороне совсем,on the other side of the river,,"['explanatory', 'context']","анте где? Малокулелёмово, рече, ",", у нас мало никогда не 
кулёмал",10131,10154,/div[1]/main[1]/article[1]/p[1],/div[1]/main[1]/article[1]/p[1],08. Заитильщина,08_ru
UxNOZkQlEe2SMXd6PXPCSQ,"у нас мало никогда не 
кулёмали","A play on the name of the town, of course, dividing up мало (little) and кулёмали (did poorly).",,['language']," рече, в другой стороне совсем, ",. И покуда он с мельником чепухо,10156,10187,/div[1]/main[1]/article[1]/p[1],/div[1]/main[1]/article[1]/p[1]/hypothesis-highlight[192],08. Заитильщина,08_ru
Pb0UekQlEe2o2c-oQ_0z9A,кулёмали,Low: to do poorly. An echo of the aforementioned town's name.,,"['register/style', 'sound play']"," совсем, у нас мало никогда не 
",. И покуда он с мельником чепухо,10179,10187,/div[1]/main[1]/article[1]/p[1],/div[1]/main[1]/article[1]/p[1],08. Заитильщина,08_ru
cWW9kEQlEe2dqHdWhPgfrg,покуда,"Low: while, at the same time.",,['register/style'],"ас мало никогда не 
кулёмали. И ", он с мельником чепуховину эту м,10191,10197,/div[1]/main[1]/article[1]/p[1],/div[1]/main[1]/article[1]/p[1],08. Заитильщина,08_ru
eOWKtEQlEe2KxgsVkOeSbg,мельником,"Miller, related to the term мельница (mill, melnitsa), playing on the connection between ""milling"" and ""pastries."" Sokolov will use the connection between torment (мука)/flour (мука) several times throughout the novel as well.",,"['metaphor', 'intratextuality', 'character']","гда не 
кулёмали. И покуда он с "," чепуховину эту мелет, пролазы 
",10203,10212,/div[1]/main[1]/article[1]/p[1],/div[1]/main[1]/article[1]/p[1],08. Заитильщина,08_ru
rWGaqEQlEe2G2ntYqaCKqg,мелет,"Colloquial: to bang on about, talk nonsense. Literally: to mill, grind. A continuation of the milling theme.",,"['theme', 'register/style']",а он с мельником чепуховину эту ,", пролазы 
наши за амбаром кота ",10228,10233,/div[1]/main[1]/article[1]/p[1],/div[1]/main[1]/article[1]/p[1],08. Заитильщина,08_ru
w5x1hkQlEe2ye0fEuBa8xg,пролазы,"Colloquial: the same as ""пройдоха"" (rascal, scoundrel).",,['register/style'],"мельником чепуховину эту мелет, "," 
наши за амбаром кота караулят ",10235,10242,/div[1]/main[1]/article[1]/p[1],/div[1]/main[1]/article[1]/p[1],08. Заитильщина,08_ru
GC0-SIekEe2HuGuRAdq4sg,Кличет ,"unusual, low",,"['language', 'style/register']",амбаром кота караулят с мешком. ,мельник на туманной заре ангорца,10284,10291,/div[1]/main[1]/article[1]/p[1],/div[1]/main[1]/article[1]/p[1]/hypothesis-highlight[262],08. Заитильщина,08_ru
4kWYjEQlEe2SRzOpEg0BZQ,мельник,"Miller, related to the term мельница (mill, melnitsa), playing on the connection between ""milling"" and ""pastries."" Sokolov will use the connection between torment (мука)/flour (мука) several times throughout the novel as well.",,"['metaphor', 'intratextuality', 'character']", кота караулят с мешком. Кличет , на туманной заре ангорца сибирс,10291,10298,/div[1]/main[1]/article[1]/p[1],/div[1]/main[1]/article[1]/p[1],08. Заитильщина,08_ru
tzhRak41Ee281tdN8SsbAw,ангорца сибирского,The Turkish Angora is a breed of domestic cat. Pictured here: ![](https://upload.wikimedia.org/wikipedia/commons/7/76/Turkish_Angora_in_Ankara_Zoo_%28AOÇ%29.JPG) The Siberian breed is pictured here: ![](https://upload.wikimedia.org/wikipedia/commons/0/06/Sibirische-Katze-Omega-1.jpg)Animal motif.,,"['explanatory', 'motif']",Кличет мельник на туманной заре ,", бродит, зычный, по-над Итиль-р",10316,10334,/div[1]/main[1]/article[1]/p[1],/div[1]/main[1]/article[1]/p[1],08. Заитильщина,08_ru
vkK2xkQmEe2ZjZ9n9gDMfA,по-над,Poetic/dialectical: along.,,['register/style'],"рца сибирского, бродит, зычный, "," Итиль-рекой, а тот — далече. Не",10352,10358,/div[1]/main[1]/article[1]/p[1],/div[1]/main[1]/article[1]/p[1],08. Заитильщина,08_ru
BOxn4rIFEe2Rq095tjQ_CA,Итиль-рекой,"The Tatar name of the river Volga. The title of Ilya's letter ""Zaitil'shchina"" is derived from this version of the river's name. Ostanin also suggests a sound link between the rivers Itil' and Lethe (Leta), the river of oblivion and forgetting, which also plays a major role in Sokolov's first novel, *A School for Fools* (10).",,"['location', 'foreign', 'language']","ирского, бродит, зычный, по-над ",", а тот — далече. Не дрейфь, рас",10359,10370,/div[1]/main[1]/article[1]/p[1],/div[1]/main[1]/article[1]/p[1],08. Заитильщина,08_ru
6zwGMkQmEe2d9KNMvh3dfw,дрейфь,"Colloquial: to be weak-kneed, be chicken.",,['register/style'],"Итиль-рекой, а тот — далече. Не ",", растяпа, в добрые руки починщи",10391,10397,/div[1]/main[1]/article[1]/p[1],/div[1]/main[1]/article[1]/p[1],08. Заитильщина,08_ru
BFP8EEQnEe2drhMilPXwbQ,растяпа,"Colloquial: scatterbrain, blunderer, goof-ball, fool.",,['register/style'],"кой, а тот — далече. Не дрейфь, ",", в добрые руки починщики 
его с",10399,10406,/div[1]/main[1]/article[1]/p[1],/div[1]/main[1]/article[1]/p[1],08. Заитильщина,08_ru
6JI1-k41Ee23UyskDGhXlQ,рукава засучает,Set expression: to do something vigorously.,,['phraseologism'],удут с рук. Сразу и новая смена ,". Верю, и сотрудники не подведут",10471,10486,/div[1]/main[1]/article[1]/p[1],/div[1]/main[1]/article[1]/p[1],08. Заитильщина,08_ru
TFjy9EQnEe2HBF9BjYUJhQ,мурлыку,"Colloquial: pussycat, moggie.",,['register/style'],"Верю, и сотрудники не подведут, ", у покупателя со двора сведут те,10520,10527,/div[1]/main[1]/article[1]/p[1],/div[1]/main[1]/article[1]/p[1],08. Заитильщина,08_ru
kl6L2k6YEe2hf5ebBgNFGA,катавасия,"A hymn sung in Eastern Orthodoxy. Derived from the Greek καταβασία (descent). Colloquial: confusion, row, muddle, mess. Listen to a recording [here](https://www.youtube.com/watch?v=efPVfBPrJg4). Sokolov is also playing on the sound similarity between *кат*авасия and кот (tomcat). The same happened to the small boat, which was stolen.",,"['register/style', 'foreign', 'music', 'religion', 'sound play', 'explanatory']"," тем 
же способом. Сходственная "," наблюдалась и с челноком. 
Не с",10588,10597,/div[1]/main[1]/article[1]/p[1],/div[1]/main[1]/article[1]/p[1],08. Заитильщина,08_ru
HrflukNSEe278WuMDNLeHg,челноком,A light wooden boat. Pictured here: ![](https://upload.wikimedia.org/wikipedia/commons/c/c1/Monoxylon._Karelia.jpg) Boat motif.,,['motif'],енная катавасия наблюдалась и с ,". 
Не скажу теперь, у кого мы ег",10614,10622,/div[1]/main[1]/article[1]/p[1],/div[1]/main[1]/article[1]/p[1],08. Заитильщина,08_ru
-Tq4GEQnEe256zsnTfYEeg,впервой,Low: the same as в первый раз (the first time).,,['register/style'],"
Не скажу теперь, у кого мы его "," утянули, слишком событие 
удале",10656,10663,/div[1]/main[1]/article[1]/p[1],/div[1]/main[1]/article[1]/p[1],08. Заитильщина,08_ru
BCUurEQoEe2zj2vhKRrmPw,утянули,"Colloquial: to pocket, steal, pilfer.",,['register/style'],"у теперь, у кого мы его впервой ",", слишком событие 
удалено, да и",10664,10671,/div[1]/main[1]/article[1]/p[1],/div[1]/main[1]/article[1]/p[1],08. Заитильщина,08_ru
VFZHCEQoEe2IaO9aXow4lg,многажды,"Dated: often, oftentimes, more than once.",,['register/style'],"амечу только — сплавляли затем 
"," и регулярно, и тоже всенепремен",10756,10764,/div[1]/main[1]/article[1]/p[1],/div[1]/main[1]/article[1]/p[1],08. Заитильщина,08_ru
aJBKcEQoEe23FE9eSyVReQ,всенепременно,"Dated: without a doubt, absolutely.",,['register/style'],"м 
многажды и регулярно, и тоже "," понятливым. Напоследок, однако,",10785,10798,/div[1]/main[1]/article[1]/p[1],/div[1]/main[1]/article[1]/p[1],08. Заитильщина,08_ru
r5E-UkQoEe2V5KNwZruApg,срезались,"Colloquial: to lose, mess up, screw up.",,['register/style'],"понятливым. Напоследок, однако, ",", осрамились, загнали весьма без",10831,10840,/div[1]/main[1]/article[1]/p[1],/div[1]/main[1]/article[1]/p[1],08. Заитильщина,08_ru
0y35IkQoEe230Ufor9x-PQ,загнали,Colloquial: to sell.,,['register/style']," однако, срезались, осрамились, ", весьма безответственному. По со,10854,10861,/div[1]/main[1]/article[1]/p[1],/div[1]/main[1]/article[1]/p[1],08. Заитильщина,08_ru
3Y4ThEQoEe2nbBtE8ras0w,после заката,"That is, between dog and wolf.",,['theme'],"твенному. По совершению купчей, ",", в куриную слепоту 
возникаем, ",10910,10922,/div[1]/main[1]/article[1]/p[1],/div[1]/main[1]/article[1]/p[1],08. Заитильщина,08_ru
PZi6aEQpEe2IdpM9e_uupA,куриную слепоту,Night blindness — a condition making it difficult to see at night.,,['explanatory'],"ершению купчей, после заката, в "," 
возникаем, как тать, у прибреж",10926,10941,/div[1]/main[1]/article[1]/p[1],/div[1]/main[1]/article[1]/p[1],08. Заитильщина,08_ru
TSG0MEQpEe2Sj1_520zPNg,тать,Dated/poetic: thief.,,['register/style'],"куриную слепоту 
возникаем, как ",", у прибрежных колов, где, по св",10958,10962,/div[1]/main[1]/article[1]/p[1],/div[1]/main[1]/article[1]/p[1],08. Заитильщина,08_ru
Io74ypNUEe2wdw8vm4ibeg,сударь,Dated: sir.,,['register/style'],"в, где, по сведениям прогнозов, ", сей лодку нашу намеревался держ,11013,11019,/div[1]/main[1]/article[1]/p[1]/hypothesis-highlight[278],/div[1]/main[1]/article[1]/p[1]/hypothesis-highlight[278],08. Заитильщина,08_ru
WVLhjoekEe2cl_fSgfNCTA,сударь сей лодку нашу,archaic/biblic word order,,"['language', 'bible']","в, где, по сведениям прогнозов, ", намеревался держать. Смотрим — ,11013,11034,/div[1]/main[1]/article[1]/p[1],/div[1]/main[1]/article[1]/p[1],08. Заитильщина,08_ru
axA1XEQpEe2Zybu0TcehHg,сей,Archaism: this.,,"['archaism', 'register/style']"," по сведениям прогнозов, сударь ", лодку нашу намеревался держать.,11020,11023,/div[1]/main[1]/article[1]/p[1],/div[1]/main[1]/article[1]/p[1],08. Заитильщина,08_ru
fQQ8SkQpEe2nysdnuuL_ZQ,намеревался,"Literary: to intend, have in mind, propose.",,['register/style'],"рогнозов, сударь сей лодку нашу "," держать. Смотрим — 
нет плоскод",11035,11046,/div[1]/main[1]/article[1]/p[1],/div[1]/main[1]/article[1]/p[1],08. Заитильщина,08_ru
rYLbYEQpEe2HG3NmudPTjQ,плоскодонки,A flat-bottomed boat. Плоскодонная лодка. ,,"['explanatory', 'motif']","ревался держать. Смотрим — 
нет ",", лишь груда щепы лежит. Выясняе",11071,11082,/div[1]/main[1]/article[1]/p[1],/div[1]/main[1]/article[1]/p[1],08. Заитильщина,08_ru
AKFwGEQqEe2uVG_yIKJ6Jg,"плоскодонки, лишь груда","Set expression: плоскогрудая женщина (flat-chested woman). Ilya refers to the boat, but the proximity of плоскодонки and груд (cf. with грудь, chest) brings this phrase to mind.",,['phraseologism'],"ревался держать. Смотрим — 
нет ", щепы лежит. Выясняется. Меж тем,11071,11094,/div[1]/main[1]/article[1]/p[1]/hypothesis-highlight[216],/div[1]/main[1]/article[1]/p[1],08. Заитильщина,08_ru
cUWsiE42Ee2_yLcm15GDLQ,Ковш,A traditional drinking vessel. Pictured here: ![](https://upload.wikimedia.org/wikipedia/commons/2/24/Vasilli_Matveev_Kunkin_-_Drinking_Bowl_%28Kovsh%29_-_Walters_57799.jpg),,['explanatory'],"него как раз баньку обчистили. 
"," забрали, мочало, обмылок и каза",11195,11199,/div[1]/main[1]/article[1]/p[1],/div[1]/main[1]/article[1]/p[1],08. Заитильщина,08_ru
o7GReE42Ee2Tun9MNl5p9Q,мочало,Soaked bast fibers of linden and/or other trees. Pictured here: ![](https://encrypted-tbn0.gstatic.com/images?q=tbn:ANd9GcS2YRQ4GwUsc876Klkfpj-stRA1jRohpwpHDh6sEMz5J6dQM_ENjX7mh4r2xZJzdqvAuQ4&usqp=CAU),,['explanatory'],"аньку обчистили. 
Ковш забрали, ",", обмылок и казано́к. И сетку за",11209,11215,/div[1]/main[1]/article[1]/p[1],/div[1]/main[1]/article[1]/p[1],08. Заитильщина,08_ru
sxf5Sk42Ee23fmdZYlLndQ,обмылок,Residual soap.,,['explanatory'],"чистили. 
Ковш забрали, мочало, ", и казано́к. И сетку заодно выдр,11217,11224,/div[1]/main[1]/article[1]/p[1],/div[1]/main[1]/article[1]/p[1],08. Заитильщина,08_ru
2wpN_k42Ee2sx980FYemAQ,казано́к,A large cooking pot. Pictured here: ![](https://upload.wikimedia.org/wikipedia/commons/f/f2/Sumalak_being_made_in_a_Kazan.jpg)Food motif.,,"['explanatory', 'motif']","Ковш забрали, мочало, обмылок и ",". И сетку заодно выдрали 
из руч",11227,11235,/div[1]/main[1]/article[1]/p[1],/div[1]/main[1]/article[1]/p[1],08. Заитильщина,08_ru
Yj227EQqEe2qLq-KQYWARA,промыслили,"Dated: to get, obtain.",,['register/style'],льку баня та при ручье. Егерята ,", сомнений на этот счет не лелее",11308,11318,/div[1]/main[1]/article[1]/p[1],/div[1]/main[1]/article[1]/p[1],08. Заитильщина,08_ru
ogVkCkQqEe2zrr-SaM-Mzg,обнове,"Colloquial/dated: new thing, clothes. Clothing motif.",,"['register/style', 'motif']",. И когда покупатель приплыл на , домой и обнаружил ущерб — он то,11383,11389,/div[1]/main[1]/article[1]/p[1],/div[1]/main[1]/article[1]/p[1],08. Заитильщина,08_ru
8CItlEQqEe2eFxs09qay2g,черемисы,"The pre-revolutionary term for the Mari peoples. The Mari live along the Volga and Kama Rivers and in the Mari El, Bashkortostan, and Tatarstan Republics.",,"['Russia', 'expand']","весь затрясся. Зачем 
смеешься, "," одни спросили, посиживали невда",11457,11465,/div[1]/main[1]/article[1]/p[1],/div[1]/main[1]/article[1]/p[1],08. Заитильщина,08_ru
XBI9PEQrEe2sfBfUOPa3lQ,за воротник закладывая,Set expression: to belt the grape (get hammered).,,"['phraseologism', 'theme']","спросили, посиживали невдалеке, ",": что ли, весело? Как же мне не ",11503,11525,/div[1]/main[1]/article[1]/p[1],/div[1]/main[1]/article[1]/p[1],08. Заитильщина,08_ru
bTwfzkQrEe2ccFtn3w6U8Q,Вася,Diminutive form of the name Vasilii.,,"['character', 'explanatory']","весело? Как же мне не смеяться, "," 
этот — потому что это был он —",11567,11571,/div[1]/main[1]/article[1]/p[1],/div[1]/main[1]/article[1]/p[1],08. Заитильщина,08_ru
